{
  "exam_size": 5,
  "total_questions": 9,
  "total_exams": 3,
  "exams": [
    {
      "exam_id": 1,
      "questions": [
        {
          "id": 1,
          "question": "Which of the following are programming languages? (Select TWO)",
          "answers": [
            {"id": 1, "text": "HTML"},
            {"id": 2, "text": "Python"},
            {"id": 3, "text": "CSS"},
            {"id": 4, "text": "Java"}
          ],
          "correct_answer_ids": [2, 4]
        },
        {
          "id": 2,
          "question": "What does HTTP stand for?",
          "answers": [
            {"id": 1, "text": "HyperText Transfer Protocol"},
            {"id": 2, "text": "HighText Transmission Program"},
            {"id": 3, "text": "Hyperlink Transfer Protocol"}
          ],
          "correct_answer_ids": [1]
        },
        {
          "id": 3,
          "question": "Select the database types: (Choose THREE)",
          "answers": [
            {"id": 1, "text": "Relational"},
            {"id": 2, "text": "Key-Value"},
            {"id": 3, "text": "Indexed File"},
            {"id": 4, "text": "Document"}
          ],
          "correct_answer_ids": [1,2,4]
        },
        {
          "id": 4,
          "question": "Which HTTP method is typically used to update a resource?",
          "answers": [
            {"id": 1, "text": "GET"},
            {"id": 2, "text": "POST"},
            {"id": 3, "text": "PUT"},
            {"id": 4, "text": "DELETE"}
          ],
          "correct_answer_ids": [3]
        },
        {
          "id": 5,
          "question": "Which of these are valid JSON data types? (Select TWO)",
          "answers": [
            {"id": 1, "text": "String"},
            {"id": 2, "text": "Function"},
            {"id": 3, "text": "Boolean"},
            {"id": 4, "text": "Undefined"}
          ],
          "correct_answer_ids": [1,3]
        }
      ]
    },
    {
      "exam_id": 2,
      "questions": [
        {
          "id": 6,
          "question": "Which symbol begins a single-line comment in JavaScript?",
          "answers": [
            {"id": 1, "text": "//"},
            {"id": 2, "text": "/*"},
            {"id": 3, "text": "#"}
          ],
          "correct_answer_ids": [1]
        },
        {
          "id": 7,
          "question": "Select the HTTP status codes that represent successful responses (Choose TWO)",
          "answers": [
            {"id": 1, "text": "200 OK"},
            {"id": 2, "text": "301 Moved Permanently"},
            {"id": 3, "text": "404 Not Found"},
            {"id": 4, "text": "201 Created"}
          ],
          "correct_answer_ids": [1,4]
        },
        {
          "id": 8,
          "question": "Which layout model uses rows and columns?",
          "answers": [
            {"id": 1, "text": "Flexbox"},
            {"id": 2, "text": "Grid"},
            {"id": 3, "text": "Block"}
          ],
          "correct_answer_ids": [2]
        },
        {
          "id": 9,
          "question": "Which command initializes a new Git repository?",
          "answers": [
            {"id": 1, "text": "git init"},
            {"id": 2, "text": "git clone"},
            {"id": 3, "text": "git push"}
          ],
          "correct_answer_ids": [1]
        },
        {
          "id": 10,
          "question": "Which are common RESTful HTTP methods? (Choose THREE)",
          "answers": [
            {"id": 1, "text": "GET"},
            {"id": 2, "text": "POST"},
            {"id": 3, "text": "CONNECT"},
            {"id": 4, "text": "DELETE"}
          ],
          "correct_answer_ids": [1,2,4]
        }
      ]
    },
    {
      "exam_id": 3,
      "questions": [
        {
          "id": 11,
          "question": "Which of the following are NoSQL databases? (Select TWO)",
          "answers": [
            {"id": 1, "text": "MongoDB"},
            {"id": 2, "text": "PostgreSQL"},
            {"id": 3, "text": "Redis"},
            {"id": 4, "text": "MySQL"}
          ],
          "correct_answer_ids": [1,3]
        },
        {
          "id": 12,
          "question": "Which tag is used to include JavaScript in HTML?",
          "answers": [
            {"id": 1, "text": "<script>"},
            {"id": 2, "text": "<js>"},
            {"id": 3, "text": "<code>"}
          ],
          "correct_answer_ids": [1]
        },
        {
          "id": 13,
          "question": "Choose the HTTP verbs that are idempotent (Select TWO)",
          "answers": [
            {"id": 1, "text": "GET"},
            {"id": 2, "text": "POST"},
            {"id": 3, "text": "PUT"},
            {"id": 4, "text": "PATCH"}
          ],
          "correct_answer_ids": [1,3]
        },
        {
          "id": 14,
          "question": "Which CSS property controls text color?",
          "answers": [
            {"id": 1, "text": "font-color"},
            {"id": 2, "text": "color"},
            {"id": 3, "text": "text-color"}
          ],
          "correct_answer_ids": [2]
        },
        {
          "id": 15,
          "question": "Which of these are valid JSON structures? (Select TWO)",
          "answers": [
            {"id": 1, "text": "Object"},
            {"id": 2, "text": "Array"},
            {"id": 3, "text": "Function"},
            {"id": 4, "text": "Set"}
          ],
          "correct_answer_ids": [1,2]
        }
      ]
    }
  ]
}
